{
  "schema_version": "0.3.0",
  "scene_id": "NINEL-E02-SC001",
  "movement_philosophy": "Movement follows Ninel's access to space.",
  "moves": [
    {
      "move_id": "NINEL-E02-SC001-M01",
      "beat_ids": [
        "NINEL-E02-SC001-B01"
      ],
      "name_ru": "\u041c\u0435\u0434\u043b\u0435\u043d\u043d\u044b\u0439 \u043e\u0442\u044a\u0435\u0437\u0434",
      "name_en": "Slow dolly out",
      "movement": "dolly out",
      "direction": "away from Ninel",
      "speed": "slow",
      "framing": "close to medium",
      "start": "Ninel's eye",
      "end": "Ninel in the chamber geography",
      "purpose": "Reveal only the space she can now inspect.",
      "ai_video_prompt": "A slow controlled dolly out as Ninel wakes."
    }
  ],
  "assumptions": []
}
