{
  "schema_version": "0.3.0",
  "scene_id": "S01",
  "movement_philosophy": "The camera remains more controlled than Ninel and moves only when her understanding expands.",
  "assumptions": ["A short slider or compact dolly can operate beside the chamber."],
  "moves": [
    {
      "move_id": "S01-M01",
      "beat_ids": ["S01-B01"],
      "name_ru": "Медленный отъезд",
      "name_en": "Slow dolly out",
      "movement": "Translate straight back from Ninel as the chamber opens.",
      "direction": "Backward along the chamber centerline.",
      "speed": "Nearly imperceptible, beginning on her first voluntary breath.",
      "framing": "Maintain Ninel centered while expanding from close-up to medium.",
      "start": "Tight close-up through chamber glass.",
      "end": "Medium view revealing the chamber edge and part of the monitor.",
      "purpose": "Convert a sealed mechanical image into the first degree of agency and space.",
      "ai_video_prompt": "Slow dolly out. Movement: camera translates straight backward from the chamber. Speed: nearly imperceptible, starting on the first breath. Framing: keep Ninel centered. Start: tight close-up through glass. End: controlled medium shot revealing the chamber edge and monitor."
    },
    {
      "move_id": "S01-M02",
      "beat_ids": ["S01-B03"],
      "name_ru": "Плавная дуга",
      "name_en": "Slow arc move",
      "movement": "Arc around Ninel during her turn toward the observation slit.",
      "direction": "Camera-left to camera-right around her front quarter.",
      "speed": "Slow, synchronized with the ship rotation, ending before Argo's final word.",
      "framing": "Hold a medium-close single and let the planet enter behind her shoulder.",
      "start": "Ninel in profile with the slit hidden by the set edge.",
      "end": "Three-quarter view with the planet behind her.",
      "purpose": "Transfer the scene from internal uncertainty to an external world without abandoning her point of view.",
      "ai_video_prompt": "Slow arc move. Movement: arc from camera-left to camera-right around Ninel's front quarter. Speed: slow and synchronized with the ship rotation. Framing: maintain a medium-close single. Start: profile with the observation slit hidden. End: three-quarter view as the blue-green planet enters behind her shoulder."
    }
  ]
}
